,Text,Stance,Class,Target
71,"It is not our responsibility to fund abortions. It is not Joe Bidens redemption I will need. For that, I can not participate in Murder.",-1,0,Joe Biden
72,#Biden's ego is going to bring down the whole lot. He just couldn't go home like he was told to.,-1,0,Joe Biden
73,"#JoeBiden couldnt even bring himself to say Hunter struggles with alcohol &amp; drug addiction. He framed it as mental health issues in his interview with Chris Cuomo. In promoting the crime bill, he indicted Black families &amp; Black squalor in rearing predators and addicts. #karma",-1,0,Joe Biden
74,"Your time has passed Joe, youre basically a republican at this point. Also where are your tax returns?",-1,0,Joe Biden
75,If you are a female stay 6 ft from #SleepyJoe. Maybe the economy can be warmed up with shoulder rubs and hair sniffing before the big show. The economy wont consent but that wont stop #SleepyJoeBiden,-1,0,Joe Biden
76,Media finally fact check Joe Biden after he claims again that the Obama administration 'didn't lock people up in cages' #Democraticprimary #Democraticdebate via @theblaze,-1,0,Joe Biden
77,They are just trying to fool enough older folks into siding with Biden. They know they have little hope in tricking internet savvy under 40 year olds.,-1,0,Joe Biden
78,"Congratulations, brothers and sisters! We DID IT! @MikeGravel has enough individual contributions now to be in the debates! Creepy Joe is going to need a lube for his corrupt butt! #Gravel2020 #NoMiddleGround",-1,0,Joe Biden
79,When Biden hears We need JOBS! .......He tries to call Steve Jobs and add him to his campaign Wonders why he wont answer #JoeBidenHasDementia #JoeBiden,-1,0,Joe Biden
80,"@DHSgov, Did you know that @JoeBiden is a Traitor? Did you know Joe Biden molests Children? #Biden touches women and children inappropriately.. but law enforcement ignores the actions of ... Joe Biden is a pervert. America knows. Do something.",-1,0,Joe Biden
81,"@JoeBiden Campaign guys - hand a button out at where Joe goes that says ""I am uncomfortable with affection"". Women wear it and he sees it.",-1,0,Joe Biden
82,The only thing shrinking is the brain of @JoeNBC ... Stricken with SEVERE #TDS!,-1,0,Joe Biden
83,"That is what you call a hypocrite.Just bc u think u know somebody,he couldn't have done it?Let me tell u somethin,I know joe Biden too, and there's a whole website dedicated to showing just how sick he is.He's been fondling little girls for decades.Joebiden info",-1,0,Joe Biden
84,No questions on immigration at tonight's #DemocraticDebate. That's why today members of @UWDAction rallied to demand commitment from Biden to protect our community. The democratic establishment doesn't care about us. We need to raise these issues!,-1,0,Joe Biden
85,Sometimes I wish America actually cared about the people living here and not some popularity contest. I wish people would see how Corrupt someone attacking a person in their own party is instead of informing voters. #LoseWithBiden #DNC #2020election #JoeBiden,-1,0,Joe Biden
86,Joe Biden has no fucking clue what is going on in the world right now #DemocraticDebate #DemDebate,-1,0,Joe Biden
87,Joe Biden has brought no positive change in America for 40 years!!,-1,0,Joe Biden
88,And @JoeBiden KNOWS every single one of them!! Its called the #DemocraticParty @DNC are the absolute WORST!! They LIE for a living and rob EVERYONE BLIND while they stuff their wallets with our money!! Theyre 90 yr old MILLIONAIRES who WONT RETIRE bc theyre SELFISH!!,-1,0,Joe Biden
89,Joe Biden brings fire to no one. Hes a corporate sellout. Wtf is wrong with you?,-1,0,Joe Biden
90,You should exercise your 5th amendment right and stay silent anything you say or tweet from now on may be damaging to your case and Obama #DrainTheDeepStateSwamp #BidenMafiaBoss #JoeBiden,-1,0,Joe Biden
91,Its glorious watching them attempt to spin screw up after screw up as if theres nothing to see here folks Being on #JoeBiden is going to get more &amp; more difficult because Joe is exactly who he is &amp; the more he gets exposed the more illogical the spin gets,-1,0,Joe Biden
92,"@JoeBiden just said oil industry is dead, he will end it. Tires, Plastics, med equipment, food containers, carparts, home materials, computers, cell phones etc,is made of petroleum #Deplorables, we'll be going back to living in caves, mud huts #WakeUpAmerica #DemocraticDebate",-1,0,Joe Biden
93,That's why you have no rights. We the American people do not want Creepy joe,-1,0,Joe Biden
94,"#Biden wins Ohio! Democracy 2020 Digest: Ohio to order polls closed over coronavirus 'emergency,' governor says",-1,0,Joe Biden
95,Dear Uncle @JoeBiden. That's a bunch of malarkey. And it sounds like something the #Dotard would say besides... I would've voted for you decades ago but not now. Not now. Don't do it Joe. Just. Don't. Instead just enjoy your retirement and call it good. #TimesUp #Election2020,-1,0,Joe Biden
96,"Yeah #fallofthecabal #ObamaGate Where are you involved in this? There's still room on #sleepyjoe's lap. I don't think @ladygaga is hogging the whole spotlight yet. Keep going, you might get there.",-1,0,Joe Biden
97,I really hate that cnn just cut Joe off right before he embarrassed himself by talking about making the military green. #DemocraticDebate #DemDebate #DemDebate2020,-1,0,Joe Biden
98,"What a true scumbag. If its true, which it isn't, then make him sell all his business interests to pay the child support. Or just ask Daddy @JoeBiden to pay it. Joe will probably pay her a million dollars for her to sign a child support/non disclosure agreement to make it go away",-1,0,Joe Biden
99,"Millions believed in Obama's promise of hope, then watched the Dems bail out Wall Street, placate the GOP, rather than fighting. Don't push #Biden without acknowledging failures that brought us here,, laying out what will be different.",-1,0,Joe Biden
100,The truth is that Joe Biden doesn't have dementia. He just decided to plagiarize a man who has it.,-1,0,Joe Biden
101,"@foxnewsalert @JoeBiden Fox misses the point. After a President Biden destroys the world through senile nuclear error, he wont be able to say oops or explain.",-1,0,Joe Biden
102,"Access to affordable health care is middle class? Jesus, Joe, the rest of the world is middle class then. None of them have to pay out extra after taxes for healthcare.",-1,0,Joe Biden
103,Are you going to holler at citizens in all these states or just Michigan? #DementiaJoe #Joementia #2AShallNotBeInfringed #JoeBiden,-1,0,Joe Biden
104,"Hey @DavidAsmanfox, the only folks who will buy the BS from @JoeBiden on the @POTUS tax cuts are those too dumb to realize the reason they didnt get $$back is because they paid less in taxes. They are beyond help!",-1,0,Joe Biden
105,Does @joebiden still support the border wall and compromise on climate change legislation? Sounds like a loser to me,-1,0,Joe Biden
106,America does not have a free and fair #Election2020 #CorruptDNC is stealing another election. #AmericaIsaJoke if y'all let them get away with this. #Biden will be the most pathetic ticket ever. Harris has zero self respect pimping herself out like that,-1,0,Joe Biden
107,It'll be hilarious if Joe Biden doesn't even get the Democratic nomination after all this! #2020Elections #ImpeachmentReport,-1,0,Joe Biden
108,State identification cards are free at the BMV; is Biden suggesting their too lazy to go to the BMV or too stupid to find it?,-1,0,Joe Biden
109,"If Biden becomes nominee, I WILL NOT vote for him unless he commits to passing #MedicareForAll and #GreenNewDeal",-1,0,Joe Biden
110,@JoeBiden despite media faux reportage now The country has already spoken 3X after millions and millions of wasted money...could have done some good for people in need but your big ego thinks 4 is the magic#.No thx and nope wont hold my nose to vote this time #NoJoeBiden2020,-1,0,Joe Biden
111,It's @JoeBiden's bedtime so he won't be making it to the spin room #DemDebate2 #DemocraticDebate #DemDebate2020,-1,0,Joe Biden
112,.@Education4Libs I agree. Nothing ambiguous about stupid. Stupid is just plain stupid. Thanks for your #Tweet. All need to remember #Biden became #Obama's Vice President. Birds of a feather learn what they live. Biden was once a better man before he let himself be under #Obama!,-1,0,Joe Biden
113,"@JoeBiden They quit specific,articulate on their argument..who said Chuck,Joe Don't forget the Supreme Court nomination within a year of Presidential election rule I don't like it,but that's the unofficial Biden Rule",-1,0,Joe Biden
114,Yep! All #China has 2 say 2 influence peddling #JoeBiden is Rosemont Seneca Bohai &amp; the $1.5B Bank of China gave Hunter S. Biden 2 invest. Hell fold like a mylar balloon in the cold!,-1,0,Joe Biden
115,"Biden should not be allowed to lie throughout the whole debate but unfortunately, the CNN is bias so they don't fact check anything. #DemocraticDebate #DemDebate2020",-1,0,Joe Biden
116,"Aww stop it dude, I know it seems that way, but God loves Joe too. Joe is a very bad man. Joe will pay. Vengeance and Karma both go to #JoeBiden #GodNeverChanges",-1,0,Joe Biden
117,"#DemTakeover is the way my dudes. #DemExit is electoral suicide. Sure, be Never Biden and anti-establishment like I am, but we have to work to takeover the Democratic Party. You can Green-enter too. But we cant fully divorce the Dems. @NomikiKonst!",-1,0,Joe Biden
118,I want a woman president so bad but Joe Biden ass in the way #DemocraticDebate,-1,0,Joe Biden
119,I hate #dems. I hate whom ever is now controlling @JoeBiden who is on puppet strings. I hate @JoeBiden,-1,0,Joe Biden
120,"Yes, we need an O'BidenBama Dem who's fighting #LuhanVirus and #MedicareForAll, who's been credibly accused of rape and sexual harassment, a liar who tries to lie his way out of lies, but do go on @cmclymer",-1,0,Joe Biden
121,MORE CREEPER STORIES ABOUT SERIAL PERVERT JOE BIDEN Biden Accidentally Attempted His Moves On A Female Above Age 12 & She Was Freaked Out - Smelled Her Hair - Kissed Back Of Her Head As She Stood Frozen Knowing Exactly What He Was Doing #MeToo #JoeBiden,-1,0,Joe Biden
122,"Ive never met such blind cultist like group of supporters, free market/WallSt. believers who hate the idea of #MedicareForAll and #GreenNewDeal so much that they are willing to continue selling #Joe to American People. Adielle MD - please what was Joes townhall about:",-1,0,Joe Biden
123,Nebraska Democratic Party calls on Senate nominee to drop out over lewd text | Fox News. Too funny. Our Democratic Party has no tolerance for sexual harassment. Unless your #joebiden..,-1,0,Joe Biden
124,#JoeBiden google their #ChineseConnection and see who they really are and operate!!! So what are you hiding???,-1,0,Joe Biden
125,"Hey Joe, You're RICH. How about you and Hunter donate all that Ill-gotten BILLIONS from #Ukraine and #China, and HELP those made-up 400,000 additional children. What's wrong, don't you like SPENDING YOUR OWN MONEY?",-1,0,Joe Biden
126,#JoeBiden Savaged By Democrats After Wife Claims Only Electable Candidate A candidate who cant keep up with the pace of a presidential campaign is not electable,-1,0,Joe Biden
127,"If #Biden is the last great white ""moderate"" Democrat hope, the DNC is clawing at the bottom of the barrel. #SomeoneGiveHimSoGinkoBiloba I bet #ElizabethWarren is the nominee unless Cankles hops in, or the real Democrat party dream, thrill-up-the-leg candidate, Michelle O #OhNo",-1,0,Joe Biden
128,I don't think people would have a problem with Joe Biden writing a tough crime bill for our white supremacists epidemic... #JoeBiden,-1,0,Joe Biden
129,"If this isnt a deep fake, the #DemocraticParty would be seriously mistaken to nominate #Biden Even if I agreed with his policy positions, I couldnt vote for someone who is obviously having cognitive difficulties",-1,0,Joe Biden
130,Nope that's NOT true we would be respected around the world with @JoeBiden we suffered a recession under @BarackObama guess wat he got us out of that with u only DOWN,1,1,Joe Biden
131,"Still pushing the scandal that Obama was born in Kenya? Muslim? Gay? Michelle is a man? You need help, serious help. #VoteBlue2020 #VoteJoeBiden2020 #Biden",1,1,Joe Biden
132,Gad damn clip bag ban bum stop magazine ghoster gun #Biden these primaries are good entertainment #ar15safespace #ar15 #ar15porn #gunsofinstagram #pewpew #4thofjuly #4thofjulysale,1,1,Joe Biden
133,#DemocraticDebate Wow!!! Uncle Joe just whacked Gillibrand : Whats changed ? You running for President ...,1,1,Joe Biden
134,This is why we still need Elizabeth Warren! We need her integrity & her ability to get shit done #ElizabethWarren #WarrenCoronavirusPlan #ShesGotAPlanForThat #ElizabethWarren #WeNeedWarren #NeverthelessShePersisted #ItsTimeForWomenToLead #WarrenBiden,1,1,Joe Biden
135,Don't go too far left #cornPop @JoeBiden or we will start asking questions thank 4 the heads up @JoeB good moring mike,1,1,Joe Biden
136,"Yo @JoeBiden hook up my girl, she is the best of us",1,1,Joe Biden
137,"I dont know who she is, but I'm with Joe!",1,1,Joe Biden
138,TrXmp needs a Muzzle on his mouth.. Release your taxes or Shut up! #JoeBiden,1,1,Joe Biden
139,"Ha right! And if you watch what Joe said he wasnt even threatening, he was speaking hypothetically. Im #JoeBiden regardless",1,1,Joe Biden
140,"Make sure you're all signed up to join us on Friday at 5 PM (EDT) with Former First Lady of Virginia, @DSMcAuliffe! #Biden #StudentsforBiden SIGN UP HERE &gt;&gt;&gt;",1,1,Joe Biden
141,Fired up? Fired Up. Ready to go? Ready to go. #JoeBiden,1,1,Joe Biden
142,"well, #Biden is olny dealing w/ what is remaining of what god gave him......._",1,1,Joe Biden
143,You know how bad she would lose if she was the nominee? #JoeBiden,1,1,Joe Biden
144,Yo @RudyGiuliani I swear I have nothing to hide re: #JoeBiden on my @instagram. You can call off your goons.,1,1,Joe Biden
145,This! @JoeBiden I cant believe its has to be said either Mr. Vice President #ForThePeople,1,1,Joe Biden
146,"Look, folks look, we need to look at America folks. Look, folks need to look at the big picture folks and we all need to look, folks, look, look, folks look we need, look, folks look we will, look, folks, look. We need to retake the soul of the nation folks, look. #Biden",1,1,Joe Biden
147,But I was taught good boys never swallow @DrBiden ... #JillBiden #JoeBiden #Election2020,1,1,Joe Biden
148,#TheView that's what they're doing w/ #JoeBiden &amp; #MayorPete. They say blacks support because of #Obama &amp; we dislike PB cause he's gay. Nope. We did our homework &amp; don't like PBs record &amp; we know #Biden is the best we have to beat #Individual1 &amp; restore civility.,1,1,Joe Biden
149,cant believe im about to see @JoeBiden speak at @saintjosephs!,1,1,Joe Biden
150,"Ok, Joe. You got me! (But Im blue NO MATTER WHO!) #JOEBIDEN",1,1,Joe Biden
151,What has Joe Biden that can be proven with facts? I will be damn if I let someone hold me accountable for my grown ass son actions!!!,1,1,Joe Biden
152,#InsidePolitics Why r u promoting debunk Ukranian story?? R u trying to hurt @JoeBiden???,1,1,Joe Biden
153,Naw ... Imma go with Biden / Booker 2020 @JoeBiden @CoreyBooker2020 @CoryBooker,1,1,Joe Biden
154,"As #Dems line up to endorse #Biden tonight, #Bloomberg campaign co-chair @Michael_Nutter talked w/me earlier today &amp; made the case for @MikeBloomberg.",1,1,Joe Biden
155,How bout felony joe or treasonous joe does that work for ya!!,1,1,Joe Biden
156,Ringling Brothers is back in business! Watching the Clown act right now!!!#TeamJoe,1,1,Joe Biden
157,Time to EXPOSE Obama @HillaryClinton @JoeBiden @SpeakerPelosi @AdamSchiff @SenSchumer &amp; the squad for Who/What they are Time for ALL to b #LockedUp,1,1,Joe Biden
158,"God made two and #Biden knew anything abt God he would know that , wouldnt he ? But I guess he was thinking man, woman and democrat",1,1,Joe Biden
159,So can we make @JoeBiden @BetoORourke 2020 happen for real? Come on Twitter! #BidenBeto2020,1,1,Joe Biden
160,That's exactly what I meant... I'm glad you cleared that up my sister..! #VoteJoe #VoteJoeBiden2020 #Biden,1,1,Joe Biden
161,@JoeBiden where r u. Need to see u on TV intervws. Evrybdy doing intervws. Plse we nd to hear from you now.,1,1,Joe Biden
162,Kellyanne Conway on @JoeBiden: If anybody just types in Creepy Uncle Joe Videos you come up with a treasure trove Hey Kellyanne...What happens when you type in Grab 'em by the p*ssy?,1,1,Joe Biden
163,FIGHT!!!!! @SenKamalaHarris @RepAdamSchiff @tedlieu @RepSwalwell @CoryBooker @ChrisMurphyCT @joekennedy @SenSchumer @NancyPelosi @JoeBiden @SenWarren FIGHT this!!!!! We have 4 months til the #Midterms2018 ***NO #SCOTUS til after the vote!! America &amp; #TheResistance,1,1,Joe Biden
164,"@SenJohnMcCain RIP .... @JoeBiden ""We shall never see his likes again"".",1,1,Joe Biden
165,Parent Associations at schls. R still Powerful & Schl bds. Depend On Approval Appeal for more resources call & write letters to the Bd. & State Associations Parent-teach Assoc Must mobilize #JoeBiden #NEA #NancyPelosi #HouseDemocrats #SenateDemocrats #CNN #MSNBC #Politico,1,1,Joe Biden
166,Slow Joe Mitt Romney's gonna keep y'all in chains Biden tosses his walker down and get out the vote!,1,1,Joe Biden
167,Aww come on just take my money and be President already @JoeBiden,1,1,Joe Biden
168,Another example of why I love Joe!!! Go Cierra go!!!!,1,1,Joe Biden
169,"Heres my take on this #LucyFlores allegations. We elected a man who grabbed women by the pussy, pay hush money to porn stars... now we want to destroy @JoeBiden for smelling someones hair?? Get real!!",1,1,Joe Biden
170,"White House is big mess now , mr @JoeBiden for president!!! God bless America!!",1,1,Joe Biden
171,Then we need to get @JoeBiden to kick Boltons ass up and down Pennsylvania Ave,1,1,Joe Biden
172,217 days until the inauguration of the 46th President @JoeBiden #VoteBlue up &amp; down ballot USA cuz Joe cant do it alone.,1,1,Joe Biden
173,Biden commits to a woman VP & a black woman on the SC! #DemocraticDebate,1,1,Joe Biden
174,Love my Pastor @PastorHJW POTUS-Forever @BarackObama &amp; VPOTUS-Forever @JoeBiden (really miss them)!,1,1,Joe Biden
175,Tellem like it is @JoeBiden waiting for someone to shut them down.,1,1,Joe Biden
176,"Botox #JoeBiden On #Dems Criticizing Him: ""See You Around""... Somebody ask him about plagiarizing other people's work! Somebody ask him how his cokehead son's now a millionaire thanks to daddy's VP ties Frm Ukraine and china? #AmericaFirst @weaselzippers",1,1,Joe Biden
177,"! Try putting that anger &amp; emotion to work, #VoteBidenToSaveAmerica!",1,1,Joe Biden
178,Let's not 4get @BetsyDeVosED is a billionare. Fuck u all u rich bitches. Go buy some fucking cereal w ur id &amp; stfu #FridayThoughts #rt #Repost #FridayMotivation. #viral #WhitePrivilege #USA #AmericansForImpeachment #RewriteTheRules #Liars #WhateverItTakes #Biden,1,1,Joe Biden
179,"@JoeBiden &lt;&lt;&lt;&lt;""Not A Whisper"" ..............................WELL #JoeBiden THIS TENDS TO MAKE YOU LOOK LIKE THE LIAR YOU ARE!!!",-1,1,Joe Biden
180,"#JoeBiden: ""if you don't fire that prosecutor, United States will not give you $1Billion in Aid"" &amp; ""if you don't trust me call #BarackObama Treason!! Locke Em Up!!",-1,1,Joe Biden
181,1) Werent these the same talking heads who didnt like #Biden taking credit for #Obama &amp; the work he did?,-1,1,Joe Biden
182,@JoeBiden nothing like an archived video to come back &amp; bite you huh?,-1,1,Joe Biden
183,".@funder now wants ppl to think he influenced @JoeBiden! All to promote his Super PAC @TheDemCoalition, which he uses to funnel donor to his consultant firm! For laughs, Read @grantsterns (another grifter &amp; friend of Dworkin) interview w/Scott: #AmJoy",-1,1,Joe Biden
184,Omg ima cry like a lil girl when Obama endorses Joe today,-1,1,Joe Biden
185,Biden gets things done. He damn sure got that Ukrainian prosecutor investigating his son fired #Dementia #QuidProQuoJoe,-1,1,Joe Biden
186,Well a lot of them voted 4 #HillaryForPrison &amp; #Biden so what do u expect? An ass is an ass &amp; there's nothing u can do about it.,-1,1,Joe Biden
187,I need this woman to step up and tell her story!! Her and all women who have been groped by #JoeBiden,-1,1,Joe Biden
188,"He will never love you Joe! Let it go, let it go! #EpsteinIsland",-1,1,Joe Biden
189,Just like he said he went to the college he was speaking at and it was a total lie! DM for #Biden shirts!!,-1,1,Joe Biden
190,Use union dues like his private piggy bank to help his buddy #JoeBiden,-1,1,Joe Biden
191,"Like Father, Like Son Sex, Drugs, &amp; Rock 'N Roll #Biden Crack Pipe, IDs, &amp; Badge Found In Hunter Biden's Rental Car",-1,1,Joe Biden
192,WOW!!! Guessing he doesnt kno ppl read &amp; finish degrees in jail!!#FAIL hes soo phuking clueless...&amp;to think hes running for POTUS?!?!?!?!?! AND ppl loveeee ths guy!??!?!?!?! &amp;he was the nominee for the dems?!?!?!?! #HELPMELORD #ICANTBREATHE #OMG #Biden,-1,1,Joe Biden
193,#JoeBiden at it again..... #KAG2020Landslide AGAIN: Joe Biden Presses Face Up Against Young Girl#After Promising To Give Women Space -,-1,1,Joe Biden
194,"Yeah, she really has the body for tight dresses doesn't she?? Bet he can't wait to smell her too. #JoeBiden",-1,1,Joe Biden
195,WE WILL BE BACK TO KISSING ASS ALL OVER THE WORLD ! IF #JoeBiden BECOMES #PRESIDENT,-1,1,Joe Biden
196,Hunter Biden's 'baby mama' Lunden Roberts was stripper at club he frequented via @pagesix,-1,1,Joe Biden
197,ABSOLUTELY PRICELESS interview with Sleepy Joe on CNN. They dont know what to think! #JoeBiden #SleepyJoeBiden,-1,1,Joe Biden
198,"All partisanship aside, this @JoeBiden roundtable with Michelle Kwan and @RyanFecteau was lowwww energyyyy. #mepolitics",-1,1,Joe Biden
199,"If you missed @JudgeJeanines interview with Rudy Giuliani, its worth the watch! Hes got all the goods on the #Biden &amp; hes determined to expose ALL these crooks corruption!",-1,1,Joe Biden
200,Im thinking about buying some Xerox (XRX) stock today. Can somebody tell me where I can get some of those COUPONS @JoeBiden was talking about? #SenileJoe,-1,1,Joe Biden
201,RT NatShupe: JoeBiden I love kids jumping on my lap - Biden #PedoJoe,-1,1,Joe Biden
202,#Biden just can't help him self!!! Keep ur kids &amp; babies away from #PedoJoe,-1,1,Joe Biden
203,"#Biden u r not in charge! And btw u will NEVER BE IN CHARGE! Go away, u r senile &amp; a complete 1d10t!",-1,1,Joe Biden
204,It's the truth! #Biden IS going senile! He's a gaffe machine. Funny U can't see that &amp; I'll bet U have seen the pics of him putting his hands all over little girls &amp; sniffing their hair &amp; choose to ignore them!,-1,1,Joe Biden
205,LMAO Nice try!!! We know yall cant wait for this day!! yet its surprising that nobody is bothered that @TulsiGabbard is still on? #RiggedPrimary #Biden,-1,1,Joe Biden
206,"We have to do this, we have to do that, blah blah blah!!! Joe ""platitudes"" Biden. All talk, no substance.",-1,1,Joe Biden
207,"We already have one ""Liar In Chief"" we don't need another one. #joebidenlies #Joebiden #Biden",-1,1,Joe Biden
208,The idiot just can't help himself...... He's a wreck &amp; he knows he &amp;amp; #JoeBiden are going down fast!!!!,-1,1,Joe Biden
209,Look how she reaches back to fake scratch her head! She's shook! #byebyeBiden #Biden,-1,1,Joe Biden
210,"No, you didn't focus on money for yourself, but money for your own child. #JoeBiden crazy Uncle Joe. #DemDebate",-1,1,Joe Biden
211,Joe Biden: Messy Family Affair | TMZ Live via @YouTube #JoeBiden you cant make this stuff up,-1,1,Joe Biden
212,@HillaryClinton @JoeBiden THERE's NO GETTING OVER The Bipartisan Injustices &amp; Fraud U &amp; your greedy Elitist shrt sighted Nepotistic cohorts hve Perpetrated Perpetrated Cultivating Degeneracy out of which -45 rose! his stench is on U &amp; Us all 4 Allowing It #NeverForget,-1,1,Joe Biden
213,@SpeakerPelosi just shut the fuck up!!! How about yall investigate Biden right now? Fucking idiot! #Potus45,-1,1,Joe Biden
214,"NEVER GOING TO HAPPEN PERV UNCLE JOE ..,SHOULD BE IN JAIL FOR LIFE .,",-1,1,Joe Biden
215,Well well Joe I guess I was right. Spoiled little boy who got caught trying to man up!!,-1,1,Joe Biden
216,"Not doctored.... This is all hands on dick! - Me, Joe Biden #DemDebate #DemocraticDebate",-1,1,Joe Biden
217,"This is who @JoeBiden has always been. Y'all said you knew him, correct?",-1,1,Joe Biden
218,Tell them where Michelle touched you Joe. I hope you find justice.,-1,1,Joe Biden
219,"Have u not seen the pics of Joe around kids??? Unless u r just like him, keep the kids far, far away from him!",-1,1,Joe Biden
220,This's a very sorry scene ... The Atlanta's residents have what they deserve !!! Keep voting DemRats !!! Rite Sleepy Joe??? #Biden Mayor: Keisha Lance Bottoms (Dem) @KeishaBottoms @BrianKempGA @JoeBiden,-1,1,Joe Biden
221,".@DiamondandSilk: ""@JoeBiden started all of this here foolishness here - and don't think that @POTUS is not going to respond to his foolishness.""",-1,1,Joe Biden
222,Did @ChrisCoons ask for a pause when @JoeBiden fondled his daughter as he smiled on? Sick.,-1,1,Joe Biden
223,#StaceyAbrams wants the VP gig so bad she can taste it.. cause she knows whomever gets it will be dropping the V.. that senile old fool #JoeBiden aint making 4yrs.. so she like.. Bring it Bitch,-1,1,Joe Biden
224,OH MY GOD REALLY #JOEBIDEN WE SHOULD NT ARREST FORGIENER 4 DUI RITE JO U LOOK ALITTLE DRUNK SO NOW ITS OK 2 DRUNK DRIVE &amp; KILL PEOPLE W LIVES WOW JOE SAYS DUM BLONDE STUFF WOW SO LIKE COPS DO THIER JOBS NOW JOE WANTS 2FIRE EM 4 ACTING LIKE THEY WANNA DO WORK,-1,1,Joe Biden
225,When is SE Cupp going to allow her child near #SleepyJoe? She won't answer the question.,-1,1,Joe Biden
226,"Yeah, they probably want to put yall back in chains. Right, Joe?",-1,1,Joe Biden
