,Text,Stance,Class,Target
227,"@morning_joe, yes, the #Dems had 5 #SOTU rebuttal speeches from diff folks BUT 2dy @POTUS' surrogates &amp; sycophants will be out full-force!",-1,1,Joe Biden
228,Biden says he wont be part of witness deal some Democrats reportedly eyeing #Biden ~,-1,1,Joe Biden
229,"He didnt listen to MY tweet. I told him straight out to back off of women & children. He doesnt even stop when they pull away from him - & some kids are CRYING! What do they have to do - knee him in the balls??? BIDEN - FU, you SEXUAL PREDATOR!!! Does THAT get thru NOW???",-1,1,Joe Biden
230,"When Obama & Biden use the word ""folks""...is it just me. or does it sound racist? Like Hillarys ghetto speak, or CP time or hot sauce? Why TH do they keep doing this?",-1,1,Joe Biden
231,"@SRuhle I LOVE uncle @JoeBiden. But, if he is honest w/ himself &amp; w/ us, he won't run. Been there, done that &amp; truth be known, it wasn't pretty. What wen't wrong then won't change the discourse now. Be introspective &amp; save yourself &amp; family the aggravation.",-1,1,Joe Biden
232,#DemDebate will joe Biden walk up behind his female running mate and sniff her hair? Rub her shoulders?,-1,1,Joe Biden
233,"Did you say snitching when #Biden said the wrong city??? No, I didnt think so",-1,1,Joe Biden
234,#JoeBiden (aka #JoeChina) sidesteps questions about his son's foreign business dealings but promises ethics pledge,-1,1,Joe Biden
235,"No we dont, that is why we wont be voting for Extortion Joe!!",-1,1,Joe Biden
236,Where are the me too folks again? I guess she'll come out to speak once somebody sets up a go fund me page again...#CreepyJoeBiden,-1,1,Joe Biden
237,@mitchellvii Dont you love it when @POTUS &amp; Reps use Dems own words to campaign? Like @JoeBidens No FBI INV &amp; now Ole Harrys birth arg?,-1,1,Joe Biden
238,I told #CornPop You may cut me but Im gonna wrap this chain around your head. #JoeBiden,-1,1,Joe Biden
239,I wanna see #HunterBiden's Tax Returns=how Daddy Biden got around that lil obstacle-Hunter's Financials may come out in Paternity Case vs him in Arkansas-IMPO Joe Biden USED his drug addict son to make BIG $in #Ukraine-poor sonny didnt have a clue WTH he was doing on that Board.,-1,1,Joe Biden
240,how desperate is #JoanBiden to be #FLOTUS (?) that she would allow her husband to go through this...#Biden,-1,1,Joe Biden
241,@JoeBiden Id bet u would love to b at the border to cuddle the little girls wouldnt u.? Signs of a pervert r there dont let ur kids close to this perv.,-1,1,Joe Biden
242,#JoeBiden &gt; small donors are fools to give to @JoeBiden &gt; his door will never be open to you.,-1,1,Joe Biden
243,@JoeBiden BLACK FOLKS? Really Joe! You sound like a plantation master! You left out saying dem black folks. You owe the African Americans (black folks)an apology asshole!,-1,1,Joe Biden
244,"""Catch her at @JoeBiden's event"" -- sounds like exactly what Biden's press people did! Catch her and trap her! @hgsmoot",-1,1,Joe Biden
245,Just Wow! He got the nickname Grabby Joe decades ago. He knew exactly what he was doing and to put the responsibility on her...SMH,-1,1,Joe Biden
246,"He used way too many words that Sleepy Joe.....""We need a President"" is all that was required....Crazy old Joe!",-1,1,Joe Biden
247,"Shes coming round the bend for yah, Joe. And Im here for it! #Dems #DemocraticDebate",-1,1,Joe Biden
248,#JoeBidens reaction after #KamalaHarris told him she was the little girl who he helped get bussed out of her school district. #2020Election #KamalaHarris2020,-1,1,Joe Biden
249,Poor Joe!! Hes never been able to keep his mouth shut!! I remember Obama looking at him like he could smack him!,-1,1,Joe Biden
250,@JoeBiden Aint Called #JoeBiden 4 Nothing! Shame These Old Buzzards Only Get Busted When Theyre A Hundred !!! Even If He Was Caught Younger... #TraitorJoe Wouldnt Hang Around Long Anyway! SO BOLD HE DOES IT ON CAMERA !!!,-1,1,Joe Biden
251,#Biden Pay to Play w #Ukraine &amp; #China just for starters. This wont get going till the General The Dem Candidates &amp; their Debate Moderators wont bring it up! Watch! @peterschweizer,-1,1,Joe Biden
252,"Guess @joebiden and @jillbiden think crack is good, impregnating strippers and then lying about it is good, trying to get out of paying paternity is good.... No wonder they raised such a shameful son.",-1,1,Joe Biden
253,@JoeBiden is a child touching pervert. How apropos that the Dem Party would support him,-1,1,Joe Biden
254,When he said #JoeBiden was only a good VP because he understood how to kiss Barack Obamas ass!,-1,1,Joe Biden
255,"""They do not, they do not, they do not, reach conclusions! They do not make recommendations"" @JoeBiden, speaking of the FBI. #ConfirmKavanaughFriday #IBelieveKavanaugh #KAG2018, electorally exterminate these double-talking frauds.",-1,1,Joe Biden
256,"I wonder, when they cloned #JoeBiden did they mix up his brain download with GWs?",-1,1,Joe Biden
257,North Korea: #Biden is a fool of low IQ...... They got 1 thing right. @rach_kookogey,-1,1,Joe Biden
258,B is for BURISMA @JoeBiden ... N is for Nepotism @DNC Have a blessed day @POTUS M,-1,1,Joe Biden
259,"walking around with u wearing it on his neck. Big @JoeBiden f'n deal! i gotta built in stethoscope for u, grl. u dig?! @ABC7NY",-1,1,Joe Biden
0,President Donald Trump clearly believes in global warming after this Greenland purchase cry. #ClimateDebate #GlobalWarming #Republican,1,0,Donald Trump
1,"Rashida Tlaib normal tweets make her seem like shes a PR firm for Hamas, but despite tweeting about VP Mike Pence being in Michigan. #Tlaib still made herself look like a #triggered dimwitted #Democrat. #Squad #Pence #Trump",1,0,Donald Trump
2,Follow the money and youll find the corruption... SA->US->Asia->EU Do the research to find the answers. @Education4Libs @StormIsUponUs @cjtruth @prayingmedic #Trump #GreatAwakening #TheStormIsComing #TheStormIsUponUs #DrainTheSwamp #DeepState,1,0,Donald Trump
3,.YEAH #MAGA #Mississippi YESSSSSSSSSSSSSSSS!!!! just heard the good news about #Cindy-#HydeSmith #MAGA #GOP #SENATE SWEEP. Thank you @realDonaldTrump for going the extra mile and campaigning in Old Miss.,1,0,Donald Trump
4,"Domestic issues, the US-led trade war, and swine fever are all putting a brake on China's rapid expansion. #winning #Trump",1,0,Donald Trump
5,"How do we get more STEM and #manufacturing jobs? The #KigaliAmendment, says school counselor from Iowa. @realDonaldTrump time to send Kigali Amendment to the Senate for ratification!",1,0,Donald Trump
6,Plastic face Nancy needs to have her eyes checked. She cannot stand the fact that President Trump is so Loved and she is so hated. @TeamTrump #NancyPelosi #plasticnancy,1,0,Donald Trump
7,They cant handle the truth! @realDonaldTrump is the truth &amp; doing leaps and bounds more for this country than any other President. #MAGAStrong #MAGAFam,1,0,Donald Trump
8,On Parler I have same everything @eyesadeplorable Let's do this Already Parler is #1 app download tonight On fire It's our new home #maga #kag Our safe space @realDonaldTrump Can't wait for you #Parler I don't know all of how to use but enough,1,0,Donald Trump
9,"#MAGA2020 #KAG Watch ""LIVE: President Trump Speech at USMCA Event with American Auto Workers In Warren Michigan"" on YouTube",1,0,Donald Trump
10,"Following all now, except the one I can't click on....also as many RT's and Likes as Twit allowed me to follow, which wasn't very many. PLS follow me back, MAGAs? #Trump",1,0,Donald Trump
11,"#Trump are truly war whores, as are their partners in crime in the congress. There is a time for war and a time for peace. a time to befriend and a time to make enemies. There was a time I listened (to them) and now is a time to route them out an expose them.",1,0,Donald Trump
12,@marklevinshow : 'Human souls were slaughtered ... and they're attacking our #president' - #ConservativeReview | Mark is right again. #NZ Mosque attack had nothing to do with #Trump. #WalkAway #Jexodus #JobsNotMobs #StopTheIndoctrination #Trump,1,0,Donald Trump
13,A blast from the past but NEVER FORGET what Bill/Hillary & the rest of the Dems REALLY think of us. @realDonaldTrump has been honored many times (even alongside Rosa Parks) for his lifting up of minorities... #WalkAway #WalkAwayFromDemocrats #VoteGOP,1,0,Donald Trump
14,I just knew Trump must have won the popular vote too! I don't know any people so uninformed as to vote for HRC! #VoterFraud #DemocratDeception #CCOT,1,0,Donald Trump
15,"Pres Trump tells black lawmaker to clean up 'disgusting, rat and rodent infested' district. This is NOT racist! #TRUMP #BLM #KAG #Impeach (start a war!)",1,0,Donald Trump
16,"Why do extremely wealthy, agenda-driven globalists think THEY get to buy who is President? Oh... probably cuz theyve been doing it forever. NOT THIS TIME! @realDonaldTrump is for #WeThePeople and #AmericaFirst Koch Bros are for the Koch Bros, NWO and chaos #Winning",1,0,Donald Trump
17,Michelle Obama urges young voters to 'take their power back' via @YahooNews #Trump #RedWaveRising #VoteRed @foxtrotmike1112,1,0,Donald Trump
18,"Much like gun owners rush to the gun store when a Democrat is elected president, Trump has driven Democrats and moderates to the polls. The GOP has made a misstep by putting all their eggs in the Trump basket. #VAelections #2020Elections",1,0,Donald Trump
19,"#FakeNews #PaulaReidCBS Husband is a lobbyist for #China Her bosses probably told her to behave that way toward our #President and she did, like a good little soldier. #KAG2020 #DemocratsHateAmerica #DemocratsAreDestroyingAmerica #Trump will expose the hacks!",1,0,Donald Trump
20,"#DonaldJTrump NYPD CAN NOT ARREST There is NO BAIL!!! A RAPEST, CONVICT WALKED FREE AFTER 30-MINS*TO COMMIT ANOTHER ASSAULT! NYPD HAS HANDS TIED. THEY WALK AWAY SCOTT FREE. NYPD NEEDS SUPPORT FROM THE POPULATION IM IN OKLA. &amp; I CAN SEE IT, DON'T SHUT #2",1,0,Donald Trump
21,"If the dems are so eager to impeach, why didnt they do it in the 12 years of the Bushs Presidencies? DT is a bad man, doing bad things, and he thinks hes above the law. He isnt. #ImpeachmentVote #Trump",1,0,Donald Trump
22,you do know @POTUS won in spite of #Trump opposition. How fitting that many will be financially supported by Democrats as many of them voted for HRC.,1,0,Donald Trump
23,Only libs would whine about the minor side effects of #hydroxychloroquine when it's literally saving their life. All real #Republicans should be taking it twice a day for their health. Also helps prevent #heartdisease. /s @realDonaldTrump @GOP,1,0,Donald Trump
24,"Sorry, but there's no such thing as a transgender child. They're too young to understand what gender means. They just want 2 play and what they play with does not define gender. Why do liberals constantly insist on taking away the innocence of children? #Trump",1,0,Donald Trump
25,#Democrats and the #DemocraticParty have thrown their constituents under the bus time and time again #WalkAwayFromDemocrats and #WalkAway from those affected by #Trump,1,0,Donald Trump
26,"Support him or not, this is something that has gotten under my skin for years about this generation of reporters and journalists. Name your source, bro. #sourceoritdidnthappen make that #viral. #MainstreamMedia #thatQlife #QuarantineLife #QAnons #Trump",1,0,Donald Trump
27,The #DEMS r making this 2 easy 4 the GOP Who would vote 4 the #DEMS when they defend savage beasts who use a hatchet 2 behead &amp; cut up bodies Their victims r Latinos U think they will vote 4 you MS13 r lower than ANIMALS @AnnCoulter @RealJamesWoods @realDonaldTrump @seanhannity,1,0,Donald Trump
28,"You have done an incredible, exemplary, genius executive job for the free people US Citizens of America! Thank you! So proud to be an American! You make it functional, safe, brilliant job. All of you! @PressSec #Trump @stevenmnuchin1 @senatemajldr @GOPLeader",1,0,Donald Trump
29,@repjohnlewis is a bastard. I don't wish him any harm or death but that doesn't change my opinion. And @JacksonLeeTX18 is not any better. @TheDemocrats are nothing but corrupt cretins. #CorruptDemocrats #Trump,1,0,Donald Trump
30,Good Morning #Patriots BOOM: Trumps Economy Just Got FLOODED With Billions Of Dollars And Thousands Of Jobs #MAGA #BuildTheWall #StandUnited #KAG %,1,0,Donald Trump
31,This VIRUS is a slow motion series of nuclear weapons going off all over the country IT IS A FIRST STRIKE WEAPON WAKE UP PEOPLE #realDonaldTrump #FoxNews #CNN #Election2020 #GOP #Democrats #coronavirus #COVID19 #CoronavirusOutbreak #StayHomeSaveLives #StayHome,1,0,Donald Trump
32,@SenSchumer you really made a fool of yourself You had the opportunity to NOT support the SHAM of the House #Dems So I expect that your fragile legacy will end up like @SpeakerPelosi Signed @realDonaldTrump PS: Great job working with @NYGovCuomo to drive out residents,1,0,Donald Trump
33,"I get a lot of positive calls about it ... what do you have to lose?"" #DonaldTrump",1,0,Donald Trump
34,Church should have fund providing emergency food for it's members. This also concerning: ! ##TrumpTrain #Election2020,1,0,Donald Trump
35,Amen. Shapiro is a Never Trump snob. Hopefully more people see him for what he is.,1,0,Donald Trump
36,This is part of why no one stands a chance against @realDonaldTrump in 2020. Bring on the Democrat wimp that will run against him. Train wreck for the Dems.,1,0,Donald Trump
37,"When your @POTUS raps about employment numbers, you know you voted for the right man. @realDonaldTrump #SOTU #StateOfTheUnion #Trump",1,0,Donald Trump
38,The president #DonaldJTrump says he has no symptoms and hasnt been tested due to scheduling issues #Covid_19 #coronavirus,1,0,Donald Trump
39,"United States President Donald Trump recently signed the TAIPEI Act, supporting Taiwans aspiration to expand relationships with other countries in the world.",1,0,Donald Trump
40,".@RepAdamSchiff I see that you are toeing the Party line and ignoring the anarchy in our streets funded by your savior, Soros. #RussiaTrumpCollusion didn't work #GenFlynnSpying didn't work #MuellerSpecialCounsel didn't work #Impeachment didn't work #COVIDLockdown didn't work Riot",1,0,Donald Trump
41,"@BarackObama appt judge, Patricia Millette favored pharmaceutical companies over @realDonaldTrump attempt to lower prescription drug costs. #POTUS wanted drug companies to disclose prices of drugs in ads.#Dem Millette said #WeThePeople have no right to know",1,0,Donald Trump
42,"Small hands, so how? RT @realDonaldTrump: The Democrats are allowing a ridiculous asylum system and major loopholes to remain as a mainstay of our immigratio",1,0,Donald Trump
43,"Mr. #PresidentTrump, I am very very very concerned that ""IF"" these #criminals don't see #prison, the American people, who are sooo uninformed, might turn like pilot fish, in a herd...back to the #Left &amp; the #Dems. #CATASTROPHIC for #AMERICA! -@realDonaldTrump",1,0,Donald Trump
44,My Pillow CEO Rips Media for Recession Chatter: 'They're Going To Destroy One of the Best Economies' @realMikeLindell #Trump,1,0,Donald Trump
45,There is nothing in the world like the spirit of American patriots! We ALWAYS pull together in times of crisis & this time will be no different. With God's help we will make it! #GodBlessAmerica #ThankGodForPresidentTrump #Trump,1,0,Donald Trump
46,Because the #democrats are scared as hell that @realDonaldTrump might defeat this illness #COVID19,1,0,Donald Trump
47,No matter how hard you try critics will always see the native picture of your success #DonaldTrump,1,0,Donald Trump
48,"The Audacity of this man kills me. Trump, you can't use the Presidency for your own Damn Personal Finances.",1,0,Donald Trump
49,He just gets nothing done for Baltimore or the American people! Youre fired!! @realDonaldTrump #mueller #muellerfail #Cummingsgotogo #CummingsAFailedLeaderInBaltimore #ShiftySchiff,1,0,Donald Trump
50,Found a new #Patriot to follow. Would appreciate a follow back from @AnonCassi. Thanks! #PatriotsUnite #Trump,1,0,Donald Trump
51,"Good! Stay healthy, @POTUS We need you for another 4 years! #TRUMP2020LandsideReElectionVictory #Trump",1,0,Donald Trump
52,The Woman's March Wasn't About Women Just Like Black Lives Matter Wasn't About The Welfare Of Blacks It All About The Left #Dems Feeding Their Narrative To A Cooperating Corrupt Media It's All About Power and Money #Trump #2A,1,0,Donald Trump
53,#KAG2020 #DonaldTrump destroy the deep state and the swamp before it destroys are Constitutional Republic,1,0,Donald Trump
54,Trumps impeachment defense team pretends Bolton news does not exist | US news #donaldtrump,-1,0,Donald Trump
55,Of course. Russia and #Trump hold the #LadyGraham criminality tapes. Gotta be much more than gay because No one cares about that. #goprussianassets #trumpkidscorruption #trumprussianasset,-1,0,Donald Trump
56,"You are so wrong. Quit listening to mainstream. The Mueller investigation is extended to exonerate Pres Trump. Watch Judicial Watch, look at the indictments, read the reports. Be aware of the truth #MAGA #KAG. NP is going to be arrested soon. RBG is dead.",-1,0,Donald Trump
57,Only 6988 hours (or less?) until the end of President Trump's first term! #ParklandStrong #TrumpCountdown,-1,0,Donald Trump
58,"Coronavirus today USA 120k deaths 2.2 million positive #MoronTrump suggested we inject bleach, he won't wear a mask, he said the virus was a Democrat hoax, he said the virus will be gone by April, he said only 15 people had it. #DementedDonnie is a moron.",-1,0,Donald Trump
59,"I was #CruzCrew but also #Trump from the day he entered the primaries in 2015. I'm no longer #CruzCrew, but always",-1,0,Donald Trump
60,#Trump is determined to erode our constitution. He has no interest in facts or laws or decency.,-1,0,Donald Trump
61,"My representative (and fake progressive) Lacy Clay voted for Trump's shameful $738B defense authorization with Space Force. His challenger is @CoriBush. Cori won't vote for endless wars! She supports #MedicareForAll, #GreenNewDeal, and the progressive #NotMeUs platform.",-1,0,Donald Trump
62,"Im reading a lot about how the #coronavirus could defeat Trump. But it occurs to me that, using #COVID19 as his excuse, a desperate Trump *could* cancel #Election2020 by suspending the Constitution and declaring martial law. Am I wrong?",-1,0,Donald Trump
63,Trump attorney Alan Dershowitz admitting past legal malpractice to defend his current conduct is pretty interesting.,-1,0,Donald Trump
64,"You never heard #Obama tearing down #Americans, even those who hated him, because he was a grown man and a real leader, things that #trump will never be. To hear him in his divisive, childish rhetoric is sickening. He is an embarrassment to America and dangerous.",-1,0,Donald Trump
65,Cant say you were right or wrong as you are a comedian & our own President is a criminal(so stating the C word is petty when we have the #Trump )-but what we know for sure is that your description is accurate. #LIEGATE #basta #@iamsambee #guiltypardons,-1,0,Donald Trump
66,I could not have said it better. All these people you mentioned commited crimes for Trump have gigantic fines and jail time. He is loyal to no one. I don't think anyone is genuinely loyal to Trump. They are just in it for the filthy lucre. Time for any decent Repub to,-1,0,Donald Trump
67,"Actually, he broke 5. Sit down and come back when your chin descends. #Trump",-1,0,Donald Trump
68,#PaulRyan nd the rest of the #GOP r going to block it they will try to get rid of #RodRosenstein then #Mueller just like they're cover 4 #trump Both memos should be released,-1,0,Donald Trump
69,"Just a reminder that Ronna McDaniel was involved in a Pay-to-play extortion scheme of $500,000 for Trump. Blagojevich committed the same crime and was imprisoned. Why was Ronna not held accountanle? Obviously, she is a dishonest person: @GOPChairwoman",-1,0,Donald Trump
70,Is he in a cage? Because the @vp was embarrassed by the @realDonaldTrump telling another huge lie today. #Chloroquine,-1,0,Donald Trump
71,#DonaldTrump hypocrisy. There is always a tweet for everything to show it. #Hanukkah #Obama #Hypocrites,-1,0,Donald Trump
72,#DONALDTRUMP &amp;THE #GOP GAVE WEALTHY GREEDY EXECUTIVES &amp; OIL &amp; SHALE TYCOONS &amp; THERE COMPANIES OVER A TRILLION $DOLLARS IN TAX CUTS THEY DID STOCK BUY BACKS THEY LIED AND SCAMMED THE AMERICAN PEOPLE NOW THEY WANT BILLIONS OF DOLLARS IN CORPORATE HAND OUTS #NoBailoutsForBuybacks,-1,0,Donald Trump
73,"Oh yeah, just looked at your twitter page your certainly a Trump supporter ! Take a look at this bill Im sure the #Democrats have your back!",-1,0,Donald Trump
74,Trump lacks insight empathy & the capacity for self reflection. He has engaged similar people throughout his administration. This is only what you get. 2+ yrs in office & all they've done is point their finger & blame others #Dems for this. Pence was disgusting in his interview,-1,0,Donald Trump
75,Send her back with her chain migrated family. Lock him up with the rest of the #Trump,-1,0,Donald Trump
76,"CRIMINAL DON, the 2ND RATE CON MAN, @realDonaldTrump #TrumpCrimeFamily;@GOP enablers/participants in trump criminal activities; trump Administration enablers/ participants! trump and these ppl - HAVE PERPETRATED THE BIGGEST CRIMINAL CON JOB IN HISTORY on CITIZENS of U.S!",-1,0,Donald Trump
77,"Thank YOU @RVAT2020 I am SORRY your party sold their soul to hate, FEAR, GREED and the Anti-CHRIST himself @realDonaldTrump!",-1,0,Donald Trump
78,"1. Legal Question for @Penn: If Penn allows @realDonaldTrump (that #MuellerReport proved committed at least 10 RICO predicate acts) to fraudulently claim @Penn degree to commit mail &amp; wire fraud, is @Penn and/or Penn's alumni endowment liable under RICO for Russian mob crimes?",-1,0,Donald Trump
79,Do we need any more reasons to dump this piece of shit? @realdonaldtrump #ImpeachedPresidentTrump #tcot #GOP,-1,0,Donald Trump
80,"OUCH: @GovBillWeld, a former Massachusetts governor who is challenging @realDonaldTrump for the @GOP Presidential nomination, calls Trumps Presidency a train wreck. #Election2020",-1,0,Donald Trump
81,"When theyll bombard the storm? According to the orange mastodon (@realDonaldTrump) thats the way to do everything, be violent, weaponized and leave all in dust!",-1,0,Donald Trump
82,Coronavirus: Fauci warns Americans will be home for several weeks as he contradicts Trumps hopes for miracle malaria drug #SmartNews #NotMyPresident,-1,0,Donald Trump
83,#DonaldTrump will be ousted in November. Even the US can't be stupid enough to re-elect this idiot for another four years. Surely!!!,-1,0,Donald Trump
84,"It's almost comical, but #Trump lies so often (although rarely convincingly) because he really believes his own lies. He WANTS his fantasies to be true, so therefore, in his own mind, they are. He has no self-awareness yet everything he says is about shamelessly promoting himself",-1,0,Donald Trump
85,"@realDonaldTrump I am willing to bet that if you asked recently re-opened steel mills to donate the steel for the wall and recently back to work construction workers to build it, they would in a heartbeat! We have your back Mr. President!! #BuildTheWallAndCrimeWillFall",-1,0,Donald Trump
86,"Aaron: Thanks for publishing these numbers. Its too bad that we live in a state where a politicians determined that testing should be deliberately suppressed to please Donald Trump. He didnt want the big numbers, and the politicians did as they were told.",-1,0,Donald Trump
87,#GOP and #Trump also want power at all cost. Their base supports guns.,-1,0,Donald Trump
88,"The only Dem that can beat Trump needs the energy to attack him first, hardest and relentlessly for a year. Kamala has that energy. #Democrats2020",-1,0,Donald Trump
89,Hey @marcorubio do you remember the Trump campaign shirts like these? If you answer no you are lying. #Emoluments #TrumpsCrimedAgainstHumanity,-1,0,Donald Trump
90,Visiting from Sedro Woolley Washington & am taking the 7:28 LIIR to Foley Square.. Will be so proud to be among hundreds of thousands of my dearest friends around the country for #FamilesBelongTogetherMarch against the regressive &amp; cruel policies of the #Trump,-1,0,Donald Trump
91,So it would appear TRICKY DONALD TRUMP IS TRICKY DICKY NIXON x100 trying to fire anyone in the path of his nefarious activities. #VOTE,-1,0,Donald Trump
92,I will be sure to safely social distance myself from that shit show. #Trump,-1,0,Donald Trump
93,"Not just Trump, we need to re-take the Senate. Donate to . Pick a swing state and volunteer for the Democratic candidate for the Senate. We have terrific candidates! #BlueWave2020 #Senate #Democrats #BlueTsunami2020",-1,0,Donald Trump
94,@NancyPelosi You should RESIGN. You know..being WHITE and All. Matter of fact... #POTUSTrump #MAGA2020 #TermLimits are due.,-1,0,Donald Trump
95,"PRESIDENT DONALD TRUMP IS NONE OF THE ABOVE! & U have insulted the entire country, all the people & all the UNITED states who VOTED 4 him!",-1,0,Donald Trump
96,Trump @realDonaldTrump Fauci didnt say an acceptable answer in testimony to Senate?! You lie against everything you do wrong to maintain laughable and insulting blameless persona... you just be best! Lol Now you argue with the reality of the pandemic too?! #realDonaldTrump,-1,0,Donald Trump
97,And Yet Another Corrupt and Sinful Christian...13 More Reasons Climate Denier Scott Pruitt Lost His Job as E.P.A. Chief #LockHimUp #FBR #Trump,-1,0,Donald Trump
98,#trump just lied that he hadn't previously said the virus was under control.,-1,0,Donald Trump
99,#realDonaldTrump I have spent my presidency knowingly lying and bullying everyday. I am up to over 3000 lies! HISTORIC!! Remember Mexico will pay for the Wall That was CLASSIC!! Or I will never cut Social Security GREAT!! My #GOP #deplorables love me!!,-1,0,Donald Trump
