,Text,Stance,Class,Target
124,If anyone buys this lame testing graphics explanation they should have their gullible damn head examined. This release was a deliberate #OperationMockingbird type fuk w/ #Bernie peeps deal. STOP being so complacent peeps. &gt; #DNCFraud,1,1,Bernie Sanders
125,"""I wrote the damn bill"" - another @SenSanders classic that will eventually end up as a meme #DemocraticDebate",1,1,Bernie Sanders
126,#ElizabethWarren attacked #Bloomberg for #BernieSanders cause she is sucking up in order to be his vice president...(tgj),1,1,Bernie Sanders
127,#Election2020 This is what low info voters &amp; people who use their feelings on the Left sound like. Warren Supporters Mixed On Bernie via @YouTube,1,1,Bernie Sanders
128,"side note from my usual kpop shit, but some states have elections tomorrow and im just here to remind u to #Bernie yall",1,1,Bernie Sanders
129,Drama Drama Drama Bernie... put on your grown up panties and start working for the American ppl again!,1,1,Bernie Sanders
130,I just took action on @theactionnet: Labor for Bernie 2020 Pledge!. Take action here: ; #VoteForLabor,1,1,Bernie Sanders
131,don't pump your de rigueur hard line self effacing bull shit at us drop out and #BernieSanders,1,1,Bernie Sanders
132,Did This bitch Elizabeth Warren really just raise her hand when Bernie Sanders said Native Americans? #DemDebate #BernieSanders #ElizabethWarren,1,1,Bernie Sanders
133,"What will @PBS say when #Bernie wins, Its a Cinderella story; he came outa nowhere .. #BehindTheCurve",1,1,Bernie Sanders
134,"Am hoping #Bernie fights back tooth &amp; nail, no holds barred! #Berners stand behind him, beside him, with him! Look out DNC - we are the underdogs &amp; when you ain't got nothin', you got nothin' to lose!",1,1,Bernie Sanders
135,"U just qualified 4 my #Moron Test-Who would B better 4U &amp; UR Family? I picked #Bernie B/C im NOT a Moron,R U? Must answer or get lost!",1,1,Bernie Sanders
136,@BernieSanders i feel the bern when my boyfriend assfucks me till my ass looks like a he launched a a-bomb to my ass,1,1,Bernie Sanders
137,I'm here for #TimRyan telling #Bernie he doesn't have to yell.... and now BS tryna talk softly #DemDebate,1,1,Bernie Sanders
138,Just keep telling you fuckin truth!! We and our #BernieSanders movement respect you!!,1,1,Bernie Sanders
139,"@BernieSanders blah blah blah go away ,,, you have done nothing in all your years in the Senate .. some socialist ..bah",1,1,Bernie Sanders
140,Why cant yall give Bernie his just dos when the candidate is doing it?,1,1,Bernie Sanders
141,When you know your wrong you just keep acting like your completely shocked all the way out the door lol #Bernie knows she would of probably started some shit so he said nah Get her outta here lmao,1,1,Bernie Sanders
142,Seth Rich ( #Bernie supporter ) leaked these emails to @wikileaks. He knew they rigged it for #Clinton,1,1,Bernie Sanders
143,"#DNCFraud Sorry to say but if you know anything about US #Evoting #hacking problem, even millions or gazillions of #Bernie votes won't matter &amp; can (and WILL) be hacked again. &gt; Watch Def Con hackers show E-voting vulnerabilities in a brief hacking demo &gt;",1,1,Bernie Sanders
144,"ok...so, I like #Bernie...but he ain't up on reparations: somebody needs to get him fresh on what wealth desparity means.... i.e. monetary compensation... .. stop playing Bernie... you sure you woke? .. we...",1,1,Bernie Sanders
145,Y Barun fans r so abusive N to think even I was a blind fan n follower of his till Tanhaaiyan it hurts me now Bt still I luv #Bernie n #Sanz I can't blame them for their fan's stupidity,1,1,Bernie Sanders
146,"Deep breath Exhale Deep breath Exhale Now repeat after me... ""President Bernie Sanders"".... #BernieSanders",1,1,Bernie Sanders
147,Thank GOD! For a minute I was worried she would endorse #BernieSanders #Bernie,-1,1,Bernie Sanders
148,@SenSanders has spoken so much but said nothing....blah blah blah #DemDebate2020 #BernieSanders,-1,1,Bernie Sanders
149,Bernie needs to fuck off. We need to unite & not splinter off like #Bernie &amp; @SusanSarandon push for. #uniteblue #bluewave #voteblue #VoteBlue2018,-1,1,Bernie Sanders
150,Real life scoundrel company that holds sick folks for ransom. #MedicareForAll #Bernie,-1,1,Bernie Sanders
151,"This is rich...For all we know you might not be paying your individual fair share Bernie! Where are your taxes, lyin ass? #BernieSanders Never",-1,1,Bernie Sanders
152,This is emotional deflection & manipulation by people who keep using getting disappointed &amp; insulted &amp; having their feelings hurt cause they dont have a valid claim to put forth. Im not buying it. #FakeOutrage #BernieSanders #Bernie,-1,1,Bernie Sanders
153,Shid i guess Bernie put on some sunscreen because he didn't want to feel the burn.. #BernieDropOut #President,-1,1,Bernie Sanders
154,"Oh phuck off we don't trust a word u say, you can tell your lies to the sheeps following you. We Israeli Jews see right throw u. #BernieSanders",-1,1,Bernie Sanders
155,im sorry you had to find out this way bernie,-1,1,Bernie Sanders
156,Uh oh #Bernie Ari melber slurping old fraud bernie again Buh bye @msnbc Next.,-1,1,Bernie Sanders
157,"#BernieSanders dont wanna listen to or support Black women, but theyll damn sure twist their words and co-opt a movement. Foh.",-1,1,Bernie Sanders
158,U #BernieSanders still ButtHurt? Its been 2 weeks yall should be good by now..,-1,1,Bernie Sanders
159,"#DemocraticDebate I hate bernie sanders!! Cant stand his voice, his face, his attitude, his gestures!!!",-1,1,Bernie Sanders
160,"I have said these 10,000 times before, will keep saying them: #FuckBernie #BernieSanders",-1,1,Bernie Sanders
161,"LORD, @SenSanders IS FVCKING LOSING ON HIS OWN. Plus, I am",-1,1,Bernie Sanders
162,Move on man. We aint trading one racist for another. #BernieSanders,-1,1,Bernie Sanders
163,No telling what else we'd have found out if he &amp; Jane had EVER actually been #Transparent &amp; released their #TaxReturns! SO damn #DoneWithBernie! He needs to sit TF down &amp; Stay TF OUT of Pesidential #Election2020! #ThursdayThoughts,-1,1,Bernie Sanders
164,Hillary Clintons view on @BernieSanders: Nobody likes him. Nobody wants to work with him. He got nothing done.,-1,1,Bernie Sanders
165,As a small biz owner I work 50-60 hours a week to earn my living & I do NOT want some socialist jackass like #BreadlineBernie telling me to give up my hard-earned money to some damn welfare queen who refuses to get up off her lazy ass &amp; work #SocialismSucks #kag2020,-1,1,Bernie Sanders
166,"MUST READ, U WILL BE SHOCKED! SICK #BernieSanders 1969 MANIFESTO THAT YOUNGSTERS &amp; BABIES NEED2B SEXUALIZED 2 SUPPORT THE PORN INDUSTRY &amp; 2 SATISFY PPL'S FRUSTRATIONS. THIS IS WHAT HE WANTS 4 USA #Sanders #WalkAway #WalkAwayFromDemocratSocialists #KAG2020",-1,1,Bernie Sanders
167,How are the #BernieSanders peeps fairing tonight? Didn't we tell y'all it was rigged???,-1,1,Bernie Sanders
168,I remeber the last presidential race ... Bernie took the money and run .... just sayin,-1,1,Bernie Sanders
169,"Like #Bernie THA Billionaire??? WHY dont he give away HIS $$$instead of taxing US Citizens for his PIPE DREAMS??? I smell Ur HYPOCRISY, Val Vrga.",-1,1,Bernie Sanders
170,No dummy! Its Antifa !! Hey #PojectVeritas warned of this if #BernieSanders lost! Here we are! One his men paying protesters to get stuff! Wake up and stop spreading fake news! Stack of bricks - how did they get in all those places?,-1,1,Bernie Sanders
171,"""Does this mean you wont give me anymore money?"" - #DNC Shoeshine Boy Bernie's response",-1,1,Bernie Sanders
172,"Meanwhile, #Bernie was licking his lips and rubbing his hands together saying, ""Oh, boy, I'm almost a millionaire &amp; can strut around on Wall Street.""",-1,1,Bernie Sanders
173,Bernie tell the people the truth u lie to get votes,-1,1,Bernie Sanders
174,Young radicals everywhere see #Sanders as THE KEY that will UNLOCK ALL doors giving them POWER &amp;CONTROL 2say &amp;do ANYTHING they dern-well please! Smoke dope freely! Be unemployed &amp;get tons of FREE STUFF! The whiny irresponsible loafers who complain th loudest! Th new majority!,-1,1,Bernie Sanders
175,"See this Nut! #BernieSanders Watch @nowthisnews's broadcast: Bernie Sanders Campaigns in Columbia, South Carolina",-1,1,Bernie Sanders
176,Since when do #progressives like #Varoufakis &amp; #Bernie align w/ a #neoliberalist #globalist and #Hillary donor like #Soros?,-1,1,Bernie Sanders
177,"""Fool me once, shame on you; fool me twice, shame on me."" George Horne ----> Bernie's second run. #Bernie",-1,1,Bernie Sanders
178,"""She took my name in vain."" - Bernie referring to Amy's statement. Was that a freudian slip of his overinflated ego? Shanda. #DemDebate #DemocraticDebate",-1,1,Bernie Sanders
179,He would if he could - he knows he cant. #bernie #nevernevernever,-1,1,Bernie Sanders
180,#Bernie will switch to a DEM now to get money and then he will give DEMs his ass to kiss. #FRAUD,-1,1,Bernie Sanders
181,Why won't Bernie answer a direct question? He just skirted another one!!!#DemocraticDebate,-1,1,Bernie Sanders
182,Since u dont understand economics start here @KamalaHarris @SenSchumer @BernieSanders @ewarren Enjoy!,-1,1,Bernie Sanders
183,@billmaher why didnt you ask #Sanders about #Bernie bros that worked with #Breightbar &amp; Bannon or his vote against #Russian #sanctions? Why didnt you ask about his campaign manager-Tad Levines relationship to Manafort? He is not a Dem! What about him &amp; guns?,-1,1,Bernie Sanders
184,ddksksjdj he made all that show for no reason?? stoopid smh #Bernie,-1,1,Bernie Sanders
185,"LOL...FREE? Bernie is suckering his supporters with a notion of ""free this"" and ""free that"". #NothingIsFree #WalkAway #BernieSanders #BernieIsUnelectable",-1,1,Bernie Sanders
186,#TownHall BUT #BernieSanders LOVES Fidel Castro ... that young woman from Russia KNOWS better ..... he doesnt fool us. #FoxTownHall,-1,1,Bernie Sanders
187,AOC: Rich white men are the problem; thats why I want you to vote for a rich white man for president: #AOC #Bernie #BerninDowntheHouse,-1,1,Bernie Sanders
188,What say now Bernie Bros who harassed Yang Gang & Team Tulsi. I feel bad that his donors didn't know he would eventually bow down before the crooked establishment #BernieSanders #BernieDropOut,-1,1,Bernie Sanders
189,#Bernie needs to talk to somebody Black in his campaign about this answer.,-1,1,Bernie Sanders
190,It is no small matter that bernie sanders initials are BS!!!!,-1,1,Bernie Sanders
191,"Starting with how they HARP on the #ElPaso shooter &amp; totally ignore that the #DaytonShooter was a #Warren #Bernie &amp; #AOC FAN! Or that the EPShooter's other motive ws #ClimateCrisis 2 many people, &amp; these ideas had nothing to do w/ @POTUS #ReadtheManifesto",-1,1,Bernie Sanders
192,"...and Bernie Bros wonder why they face hostility. They have ""inspired me"" to be a #NEVERbernie.",-1,1,Bernie Sanders
193,Go #Bloomberg Go !!! Hashtag the Hare &amp; the tortoise' #GoBloombergGo Jump to the head of the class Money talks BS walks #BernieSanders stopped in his tracks,-1,1,Bernie Sanders
194,"Video: Rigged - ""Moderates Im talking to say they hope Warren stays in the race in order to keep Bernie from ascending too much"" #Sanders #Buttigieg #Hampshire",-1,1,Bernie Sanders
195,"but they want us 2 believe the #honesty of these 2 individual #GTFOH Aint #faithful to your spouse yet u want us to trust u 1-niter NO on-going fling #Bernie they didn't think high of u I just saw my first Bernie Sanders bumper sticker. Made me want to key the car, Page 2015",-1,1,Bernie Sanders
196,its annoying the fuck out of bernie supporters and they want to prove that a dem centrist will lose 2/2 #Bernie,-1,1,Bernie Sanders
197,"LOL Yeah paying the feds, nation wide, 24/7 for a week, is what I call some serious #JobCreation #ChaChing Paid for by, guess who?? #caravan? Nooo #Illegals? Noooo #Bernie&amp;Company? Noooo #DNC? HELL No. #WorkingClassCitizens I dont mind paying Canine tho",-1,1,Bernie Sanders
198,This miserable #BernieSanders still following me KAREN ... go play with your cat ... you soooo for the this and that you aint shit Bisssh thought you was gone insult me or talk down to me Nawl bisssh #Blindprivilege,-1,1,Bernie Sanders
199,"Im no expert on black people, but one thing I know is that they dont like #BernieSanders",-1,1,Bernie Sanders
0,This and so many other civil rights causes Biden has championed thru the decades is why he's winning in the South. We remember.,1,0,Joe Biden
1,"A realtor would look with embarrassment at what the occupiers had done, and suggest you use your imagination to imagine the possibilities.... #2020election #USelection #Biden",1,0,Joe Biden
2,"Our right to vote is our right to a future at this point, a future we can be proud to hand to the next generation. That is not what we have right now. This country has a lot of work to do, but were in, ALL IN with #Biden and our future has hope again.",1,0,Joe Biden
3,What the ever loving fuck could possibly convince anyone that your paltry distance from the @gop is enough to wash your hands clean of the blood they bear for your years of silence and capitulation? 100% #RidenWithBiden #amash_gopindisguise #Biden,1,0,Joe Biden
4,@KellyannePolls at least one of you had good common sense #JoeBiden,1,0,Joe Biden
5,Joe we really need universal healthcare.. please have it in your agenda,1,0,Joe Biden
6,...and the Dems have Biden. Think thats a good look?,1,0,Joe Biden
7,One year ago today @JoeBiden took a selfie with my phone.. still shook,1,0,Joe Biden
8,Listening to @JoeBiden s words for @SenJohnMcCain felt like he was talking to me too. My mom died almost 3 months ago. THANK YOU both for your service,1,0,Joe Biden
9,He's OLD and out of touch @CNN @MSNBC You want the establishment--obviously..... #JoeBiden,1,0,Joe Biden
10,#GrahamandCruze Truly amazing that these men can still stand without possessing Spines. Medical miracle. Just wow. So inspirational. #AdamSchiffHasMyRespect #adamschiff #JoeBiden #SenateTrial,1,0,Joe Biden
11,"Wow. Be that as it may....it doesnt have to be true, they just need to say it on live tv and then the #MAGAts will run with it. It will be nice to return dignity and honesty to the Presidency in November. #VOTE #JoeBiden",1,0,Joe Biden
12,"Biden talking about climate change does nothing to change my opinion that he has amazing fire and sees a problem, but has no clue how bad the problem really is or the level of revolution that it will take to fix. I hope I'm wrong. #DemocraticDebate",1,0,Joe Biden
13,"#BidenWon #Biden Please listen to the man you want to vote for, do we want more lies in the White House?",1,0,Joe Biden
14,"That would be a huge no. Just yesterday I read that Condi still supports 45. AFAIK, she hasn't spoken against anything 45 has done or said, and hasn't supported Biden. So why even go there? We'll have a very strong Dem ticket. #2020Election",1,0,Joe Biden
15,"The court, senate and house. We cant let this division happen again. You job Mr. Biden, is to build a team of crack specialists, scientists and great minds, remove the offending interloper and make change. This tweet will not self destruct in 3 seconds GOOD LUCK!",1,0,Joe Biden
16,Are they the ones #JoeBiden talked about putting back in chains or the Indians that own 7 elevens? Hes been yelling and doing nothing but playing politics for over 25 years.,1,0,Joe Biden
17,"The race for the presidency has started, The best one is to win! that is to say @JoeBiden!",1,0,Joe Biden
18,Love talking to Granite State voters with fall backdrops like this hit the doors with #JoeBiden during Knock-tober to remind your neighbors to vote for @JoeBiden on February 11! #nhpolitics,1,0,Joe Biden
19,"#NewBluehand #Bluehand The members of the NRA are not our opponents the vast majority of them support common-sense reforms, including universal background checks. The gun manufacturers who bankroll the NRA are our opponent. As president, Biden will defeat them. #DemDebat",1,0,Joe Biden
20,"In fact, @billmaher #STAFF #Booker get @ItsTraceyAshley on #RealTime, she'll light up the night! Also, get 3 Candidates at a time to come do a ""Special Panel Show"" with you. #Warren, #Biden, #Buttigieg would make a great show!",1,0,Joe Biden
21,OMG. I cant wait for this to be the case again. Im sick of the hate and disaster 45 had engulfed unpon us. #JoeBiden,1,0,Joe Biden
22,#JoeBiden Those of you who think his behaviour impairs his father ability to lead should google behavior of siblings &amp; children of former presidents &amp; noted leaders Heck look within your own family Lots of instances of extreme variance within a family,1,0,Joe Biden
23,How I feel everytime @ewarren comes up with a new SCAM PLAN: #WeDaBest #JoeBiden,1,0,Joe Biden
24,WARNING!!!!!! THE FIRST COMMENT ON THIS TWEET CONTAINS AN IMAGE THAT (WILL)MAY BE OFFENSIVE TO SOME VIEWERS-DEPENDS ON YOUR VIEWS ON WOMENS RIGHTS-JUST KEEPIN' IT REAL-THOUGHTS FROM THE COURTHOUSE BATHROOM- #ORANGEOUT #BIDEN #CHOICE #VOICE #VOTE #ROCK #ROLL #BALLSOUT #VOTEBIDEN,1,0,Joe Biden
25,"Every Dem that's getting shitty because people won't vote for @JoeBiden , y'all are the problem not us. #FuckTheDNC",1,0,Joe Biden
26,"I think everyone who voted for Pete or planned on voting for Pete (and now #Joe2020) also said it. We need to build bridges, not walls, &amp; welcome people to make this change in November.",1,0,Joe Biden
27,Yes. I believe it is through Joes campaign. And I would say that men of quality that support equality are welcome to join too!,1,0,Joe Biden
28,Tag every GOP member who is calling this a Hoax STILL and keeping their beaches open @RonDeSantisFL You need to GO and take that asshat @mattgaetz with you! #VoteBlueNoMatterWho #VoteBlueToEndThisNightmare #JoeBiden @JoeBiden,1,0,Joe Biden
29,A True Standard bearer in Dignity Common Decency and Humanity @JoeBiden,1,0,Joe Biden
30,I'm a Millenial and I will also be voting and campaigning for @JoeBiden!,1,0,Joe Biden
31,Powerful ticket. From electoral college perspective believe most pollsters understand a Biden or Buttigieg with @staceyabrams ticket could not be touched without #GOP expanding not extorting their base to get out and vote.,1,0,Joe Biden
32,CNN article. The meaning of the word is exactly what is happening. So once again #MyPresident is right. #CorruptNews is wrong again. 5 #Democrats (#Biden) talked about lynching or lynch mob pertaining to the impeachment of former Pres. #Clinton,1,0,Joe Biden
33,"Joe Biden says he will TRIPLE federal spending on low-income schools from $16 billion to $48 billion. He wants teachers to get a raise, thinks that AP classes should be available at all schools, and that 3-4 year-olds should get access to pre-K. What do you think? #JoeBiden",1,0,Joe Biden
34,"Biden might not be the perfect candidate, but hes miles better than the absolute disaster we have in the White House now. This is not the lesser or two evils. This is a dangerous, narcissistic evil vs a decent, selfless good. Dont confuse that choice.",1,0,Joe Biden
35,"If #Biden cant stand up to her, do you really think anyone on the ticket could? #ShesGodBalls @SenKamalaHarris and Vice President Joe Biden almost just got castrated. #democrats #republicans #manhood #StandUpForYourself",1,0,Joe Biden
36,@MSNBC @CNN @maddow @AC360 @donlemon @ChrisCuomo To the Dem 2020 candidates &amp; the Media. You may throw the Ageism card at Joe Biden but you can't take away his years of admin &amp; policy experience. #KeepFamiliesTogether #DemDebate2,1,0,Joe Biden
37,It's a #GoodFriday here in the Commonwealth of Virginia. Thank you @GovernorVA and our Democratic Legislature. #GunBillsPassed #BlueWave2020 #JoeBiden,1,0,Joe Biden
38,"'If I'm walking, I'm running': #JoeBiden tells top Democrats he's running for President one day after his brother said 'I think we're going to run'",1,0,Joe Biden
39,@JoeBiden Dear Mr. VP I am hoping/praying u r seriously considering running for the 2020 presidential race. America needs you but also we need a strong woman as your VP we need a woman in office to start to get away from the men only club Sen Harris is ur girl,1,0,Joe Biden
40,"As Joe Biden once said, ""This is not your father's Republican Party."" @JoeBiden",1,0,Joe Biden
41,Uncle @JoeBiden worked VERY well with President Obama @BarackObama . I now believe he will make a great President. Time to start pruning down this crowd of wannabe presidents @DNC @dccc @SenateDems @HouseDemocrats @NAACP,1,0,Joe Biden
42,Had a great time listening to and meeting @JoeBiden last night in support of Ohio Sen. @SherrodBrown. Also mentioned that we are both Pa. natives; he said he loves Erie!,1,0,Joe Biden
43,"Joe Biden has been a stalwart champion of LGBTQ rights. Votes he took earlier in his career can be pointed out, sure, but he evolved and became a champion of equality. That can't be denied. #DemocraticDebate",1,0,Joe Biden
44,@JoeBiden Thank you for your personal attention to the McCain children in your eulogy today.,1,0,Joe Biden
45,Im sure @DianneFeinstein is holding evidence until #Biden is confirmed as the Dem nominee. Then shell release the details in solidarity with her #MeToo sisters.,1,0,Joe Biden
46,@AP South aka KKK wing. Fact but real reason whites there started voting republican Lyndon Johnson was talked into passing the Civil Rights Act #RememberInNovember #NotMyPresident #WeThePeople #America #resist #VOTE #DAV #VFW #UnionStrong #Dems #JoeBiden #VoteBiden2020 @JoeBiden,1,0,Joe Biden
47,Hey @CoryBooker did you ask @aoc to apologize for her hateful misinformed rhetoric? Or just #JoeBiden bc he's a presidential opponent?,1,0,Joe Biden
48,#MSNBC supports @joebiden's ..he was tired...#Biden seems out of it to me. His heart isn't in it..why else would be wait so long to throw his hat in the race? Would we need to do this to the red button if he was ever God forbid elected @POTUS? #Iowa #pennsylvania,1,0,Joe Biden
49,"Joe Said, but did nothing and has no clue what to do.",-1,0,Joe Biden
50,You know what else people dont like? Systemic Pedophilia & Men who have inappropriate sexual boundaries with women & children like @JoeBiden.,-1,0,Joe Biden
51,"Poptart, you've never met me and I am NOT a leftist. Not even close, honeybun. You just showed your true colors and lost my vote with that nutty insulting remark. You're clearly too dim to do any good. You make #Biden seem competent.",-1,0,Joe Biden
52,Biden's Campaign Now So Weak Even His Wife Says Other Candidates 'Might Be Better' via @gatewaypundit OOPS! #JoeBiden,-1,0,Joe Biden
53,"We support NEITHER candidates policies. And in case you havent noticed, the #NotMeUs movement is 100% policy driven. ##NeverBiden #MedicareForAll #RankedChoiceVoting",-1,0,Joe Biden
54,Six Reasons #JoeBiden is Not Fit to be President All excellent...Creepy Joe is a liar and a sleaze.,-1,0,Joe Biden
55,"Created by Ukraine? Lolz. Sure #JoeBiden threatening to withhold 1Bn of THEIR AID if the prosecutor investigating the corrupt company paying off his son $83,000 checks for NO ENERGY EXPERIENCE had nothing to do with it.",-1,0,Joe Biden
56,Its humorous how #Biden thinks women aren't smart enough to vote for the most qualified candidates. He believes we will vote for him just so a female might be Vice President. WRONG!!,-1,0,Joe Biden
57,"Its shameful what you people are doing, you all know that man is not up to the job but you parade him on TV in his condition. He has no more strength, and unfortunately no skill. Leave that poor man alone. #JoeBiden",-1,0,Joe Biden
58,"What do you think about them calling me handsy Joe Biden? You know, since Im so hands-on with the issues. #Biden #ThursdayThoughts @JoeBiden @MeghanMcCain",-1,0,Joe Biden
59,"#JoeBiden even gets shut down by his wife. ""Not in public, you asshole.""",-1,0,Joe Biden
60,i've said before @JoeBiden has too much baggage starting with Anita Hill and now... #Election2020,-1,0,Joe Biden
61,"I'll never get over the parents that smiled and giggled as creepy Joe was feeling up their kids, right in front of them.",-1,0,Joe Biden
62,"Actually you are doing he worst, read this but Im sure youll forget it by the end of the sentence #JoeBiden",-1,0,Joe Biden
63,"We know what YOU are #CrookedJoeBiden/ #QuidProJoe. What an embarrassment to my former (#democrat) party. YOU are just one of the reasons many of us decided to #WalkAway from so-called ""#liberals"" (who aren't ""#liberal"") at all, &amp; from ""#progressives"" who just AREN'T. -",-1,0,Joe Biden
64,Is Joe Biden still alive?.. serious question - dude is the ghost of candidates .. lol #blueWave @krystalball,-1,0,Joe Biden
65,"For Harris and the others, they need to be Brutus and his coconspirators to Biden's Caesar. Take. Him. Down. Many will not have a chance to do so after tonight so this strike is crucial. #DemocraticDebate #DemDebates #CNNDebate",-1,0,Joe Biden
66,"You're right Joe. Let's ALLOW teachers who want to apply to the school board, go through extensive clearances, active shooter training + to have access to a secured weapon onsite so they can respond ASAP if something like this happens! No? Then when will it be ""enough"" for you?",-1,0,Joe Biden
67,#VoteBlueNoMatterWho sorry. I just think Biden is not progressive enough to save this country/planet. Not hating.,-1,0,Joe Biden
68,Didnt someone leak last week that Joe Biden was considering batshitcrazy John Kasish for VP? #DemocraticDebate,-1,0,Joe Biden
69,"If you hate the way things are, don't vote for #JoeBiden. He's vowed not change #WallStreet or anything else.",-1,0,Joe Biden
70,Joe Biden has really low expectations for black Americans. How is this not racist?,-1,0,Joe Biden
